pid,creator,label,_date,object_type,link,order,layout,collection,thumbnail,full,manifest
obj1,unknown,1772 geographic map of most of Spanish North America,1772,map,https://digitalcommons.csumb.edu/hornbeck_spa_1_a/19/,0,qatar_item,riw,"/img/derivatives/iiif/images/obj1/full/250,/0/default.jpg","/img/derivatives/iiif/images/obj1/full/1140,/0/default.jpg",/img/derivatives/iiif/obj1/manifest.json
obj2,Thomas Jefferys,"Chart containing the Coasts of California, New Albion, and Russian Discoveries to the North",1776,map,https://www.davidrumsey.com/luna/servlet/s/x0d827,1,qatar_item,riw,"/img/derivatives/iiif/images/obj2/full/250,/0/default.jpg","/img/derivatives/iiif/images/obj2/full/1140,/0/default.jpg",/img/derivatives/iiif/obj2/manifest.json
obj3,Jose Castro,Jose Castro proclamation to his countrymen on the eve of American occupation. 1846 August 9,1846,proclamation,https://catalog.huntington.org/record=b1862656,2,qatar_item,riw,"/img/derivatives/iiif/images/obj3_01/full/250,/0/default.jpg","/img/derivatives/iiif/images/obj3_01/full/1140,/0/default.jpg",/img/derivatives/iiif/obj3/manifest.json
obj4,Joaquin Cañete,Letter from Joaquin Cañete. Spanish soldier serving in California to Francisco Aguiar. August 30 1782,1782,letter,https://catalog.huntington.org/record=b1800930,3,qatar_item,riw,"/img/derivatives/iiif/images/obj4_01/full/250,/0/default.jpg","/img/derivatives/iiif/images/obj4_01/full/1140,/0/default.jpg",/img/derivatives/iiif/obj4/manifest.json
obj5,Fernando Xavier de Rivera y Moncada,"Letter from Fernando Xavier de Rivera y Moncada, Captain in the service of Spain in Mexico, to Antonio Maria Bucareli y Ursua, Viceroy of New Spain, May 25, 1776",1776,letter,https://catalog.huntington.org/record=b1800820,4,qatar_item,riw,"/img/derivatives/iiif/images/obj5_01/full/250,/0/default.jpg","/img/derivatives/iiif/images/obj5_01/full/1140,/0/default.jpg",/img/derivatives/iiif/obj5/manifest.json
obj6,Francisco Javier Uria,"Letter from Francisco Javier Uria friar at Santa Barbara Mission to Captain Francisco Maria Ruiz April 7, 1824",1824,letter,https://catalog.huntington.org/record=b1802537,5,qatar_item,riw,"/img/derivatives/iiif/images/obj6_01/full/250,/0/default.jpg","/img/derivatives/iiif/images/obj6_01/full/1140,/0/default.jpg",/img/derivatives/iiif/obj6/manifest.json
